{"$comment":"Descriptive, derived from the types the bounded parser reads; the parser is the only authority on validity. Where the parser reads two versions of a document with one type, this schema admits what that type admits, including members the later version adds. Byte, depth and count bounds are recorded in x-rustev-parse-limits (a string length here counts characters, the parser counts bytes), and rules applied when a plan is compiled are stated in field descriptions, not enforced here.","$defs":{"ArtifactId":{"pattern":"^sha256:[0-9a-f]{64}$","type":"string"},"CalibrationBinding":{"additionalProperties":false,"description":"What the calibration was fitted for.","properties":{"artifact":{"$ref":"#/$defs/ArtifactId"},"dataset":{"$ref":"#/$defs/DatasetId"},"method":{"$ref":"#/$defs/CalibrationMethod"},"question":{"description":"The step id of the question.","type":"string"},"task":{"type":"string"}},"required":["artifact","task","question","dataset","method"],"type":"object"},"CalibrationMethod":{"description":"The only method in increment 1.","oneOf":[{"const":"temperature/1","description":"`softmax(z / T)` over logits, or over natural logarithms of masses.","type":"string"}]},"CalibrationParameters":{"oneOf":[{"additionalProperties":false,"description":"Temperature in `(0, 1000]`.","properties":{"temperature":{"additionalProperties":false,"properties":{"temperature":{"$ref":"#/$defs/Decimal"}},"required":["temperature"],"type":"object"}},"required":["temperature"],"type":"object"}]},"DatasetId":{"pattern":"^sha256:[0-9a-f]{64}$","type":"string"},"Decimal":{"pattern":"^-?(0|[1-9][0-9]*)(\\.[0-9]+)?$","type":"string"}},"$schema":"https://json-schema.org/draft/2020-12/schema","additionalProperties":false,"properties":{"binding":{"$ref":"#/$defs/CalibrationBinding"},"options":{"description":"The options, in the step's declared order.","items":{"type":"string"},"type":"array"},"parameters":{"$ref":"#/$defs/CalibrationParameters"},"schema":{"const":"rustev.calibration/1","type":"string"}},"required":["schema","binding","options","parameters"],"title":"rustev.calibration/1","type":"object","x-rustev-parse-limits":{"allow_fractional_numbers":false,"max_bytes":262144,"max_collection_len":1024,"max_depth":16,"max_number_bytes":40,"max_string_bytes":4096,"max_total_values":20000}}
