{"binding":{"artifact":"sha256:dd216677d2360b08b53c7717560a92058b61f699539c4936f0e70878a302ab3f","dataset":"sha256:dddddddddddddddddddddddddddddddddddddddddddddddddddddddddddddddd","method":"temperature/1","question":"topic","task":"support.topic"},"options":["billing","integration_defect","account_access","other"],"parameters":{"temperature":{"temperature":"1.5"}},"schema":"rustev.calibration/1"}